{
  "allow_diagonals": true,
  "ramp_vertical_alignment_mode": "df",
  "ramp_requires_highside_support": true,
  "diagonal_rules": { "corner_check": true },
  "cost": { "base": 10, "orthogonal": 10, "diagonal": 14, "ramp_delta": 6, "stair_delta": 8 },
  "fluids": { "shallow_threshold": 1, "deep_threshold": 6, "wade_cost": 6, "swim_cost": 18 },
  "traffic": { "low": -2, "normal": 0, "high": 2, "restricted": 8 },
  "doors": { "closed_blocks": true, "open_cost": 4 },
  "movement": { "step_delay_ticks": 2 },
  "budgets": { "max_nodes_per_search": 10000, "max_paths_per_tick": 1024 }
}
